Ερώτηση;Α;Β;Γ;Δ;Σωστή
45. Ποιο από το παρακάτω μέτρα θεωρείτε ότι εντάσσεται σε ενδεδειγμένη πολιτική για την αντιμετώπιση του πληθωρισμού κόστους;;α. Η αύξηση των έμμεσων φόρων στον καπνό;β. Η μείωση του ΦΠΑ στα υλικά οικοδομής;γ. Η ισόποση αύξηση φόρων στα καύσιμα;δ. Η δραστική αναλογική μείωση των συντάξεων;
46. Για την καταπολέμηση του πληθωρισμού κόστους ενδείκνυνται μέτρα τα οποία επηρεάζουν κυρίως:;α. Την πλευρά της ζήτησης της οικονομίας;β. Την πλευρά της προσφοράς;γ. Τα έσοδα από τους άμεσους φόρους;δ. Τα έσοδα από τους έμμεσους φόρους;
47. Η βιώσιμη ανάπτυξη:;α. Αφορά στη διαχρονική αύξηση του πραγματικού ΑΕΠ (Ακαθάριστο Εγχώριο Προϊόν);β. Αφορά στην ποιοτική αναβάθμιση του εκπαιδευτικού συστήματος;"γ. Αφορά στην κάλυψη των αναγκών του παρόντος; λαμβάνοντας υπ’ όψη τις ανάγκες των μελλοντικών γενεών";δ. Αφορά στην ποιοτική αναβάθμιση των συστημάτων υγείας και την αύξηση του προσδόκιμου ζωής;
48. Ποιο από τα παρακάτω μέτρα θεωρείτε ότι αποτελεί υποστηρικτικό μέτρο βιώσιμης ανάπτυξης;;α. Η μείωση του κόστους ζωής που προέρχεται από επιδότηση μονάδας παραγωγής ενέργειας με λιγνίτη;β. Η επιδότηση φωτοβολταϊκών συστημάτων παροχής ενέργειας;γ. Η επιδότηση μονάδων παροχής ενέργειας φυσικού αερίου;δ. Η επιδότηση γεωτρήσεων για την εξόρυξη αργού πετρελαίου Πέμπτη 3 Ιουλίου 2025 έως και Δευτέρα 14 Ιουλίου 2025 Σελίδα 43 από 69;
49. Οι τρείς Πυλώνες της Βιώσιμης Ανάπτυξης είναι:;α. Περιβάλλον-Οικονομία-Ισότητα;β. Οικονομία-Ισότητα-Κοινωνία;γ. Περιβάλλον-Οικονομία-Κοινωνία;δ. Οικονομία-Περιβάλλον-Ισότητα;
50. Το δημόσιο χρέος στις περισσότερες αναλύσεις και τις οικονομικές εκθέσεις καταγράφεται ως ποσοστό:;α. Του συνόλου των δαπανών του δημοσίου;β. Του συνόλου των εσόδων του δημοσίου;γ. Του συνόλου του κρατικού προϋπολογισμού;δ. Του Ακαθάριστου Εγχώριου Προϊόντος (ΑΕΠ);
51. Ο ετήσιος Κρατικός Προϋπολογισμός διακρίνεται σε:;α. Προϋπολογισμό υπουργείων και προϋπολογισμό οργανισμών τοπικής αυτοδιοίκησης;β. Τακτικό προϋπολογισμό και προϋπολογισμό δημοσίων επενδύσεων;γ. Τακτικό προϋπολογισμό και έκτακτο προϋπολογισμό;δ. Τακτικό προϋπολογισμό και απολογισμό;
"52. Εάν υποθέσουμε ότι σε μια χώρα ο συντελεστής εισφορών παραμένει διαχρονικά σταθερός; ενώ ο πληθυσμός και οι μισθοί αυξάνονται με σταθερό ρυθμό; τότε οι παροχές ενός μη κεφαλαιοποιητικού συστήματος κοινωνικής ασφάλισης γίνονται σχετικά πιο συμφέρουσες:";α. Για τις παλαιότερες γενιές (εκτός της πρώτης);β. Για τις νεότερες γενιές (εκτός της τελευταίας);γ. Και για τις παλαιότερες και για τις νεότερες γενιές (εκτός της τελευταίας);"δ. Ούτε για τις παλαιότερες; ούτε για τις νεότερες γενιές (εκτός της πρώτης και της τελευταίας";
53. Σύμφωνα με την αρχή της κάθετης φορολογικής ισότητας:;"α. Άτομα που είναι παρόμοια μεταξύ τους; αλλά κάνουν διαφορετικές επιλογές στα οικονομικά ή στον τρόπο ζωής τους; θα πρέπει να αντιμετωπίζονται με τον ίδιο τρόπο από το φορολογικό σύστημα";"β. Άτομα που είναι παρόμοια μεταξύ τους; αλλά κάνουν τις ίδιες επιλογές στα οικονομικά ή στον τρόπο ζωής τους; θα πρέπει να αντιμετωπίζονται με τον ίδιο τρόπο από το φορολογικό σύστημα";γ. Άτομα με περισσότερους πόρους θα πρέπει να πληρώνουν υψηλότερους φόρους σε σχέση με άτομα με λιγότερους πόρους;δ. Άτομα με περισσότερους πόρους θα πρέπει να πληρώνουν τους ίδιους φόρους με άτομα με λιγότερους πόρους;
54. Ποια από τις παρακάτω ΔΕΝ αποτελεί λειτουργία του δημόσιου προϋπολογισμού:;α. Η ανάπτυξη της οικονομίας;β. Η αύξηση της προσφοράς χρήματος;γ. Η σταθεροποίηση της οικονομίας;δ. Η αναδιανομή του εισοδήματος Πέμπτη 3 Ιουλίου 2025 έως και Δευτέρα 14 Ιουλίου 2025 Σελίδα 44 από 69;
55. Ο στόχος της ιδιωτικοποίησης δημοσίων επιχειρήσεων είναι:;α. Η μείωση της φορολογίας;β. Η μείωση του μεγέθους του ευρύτερου δημόσιου τομέα;γ. Η εξασθένηση της δύναμης των εργατικών οργανώσεων;δ. Όλες οι λοιπές προτάσεις που παρατίθενται είναι σωστές;
56. Ο Φόρος Προστιθέμενης Αξίας είναι:;α. Φόρος κατανάλωσης;β. Έμμεσος και απρόσωπος φόρος;γ. Φόρος που επιβάλλεται από την κεντρική διοίκηση;δ. Όλες οι λοιπές προτάσεις που παρατίθενται είναι σωστές;
57. Ποιο από τα παρακάτω ΔΕΝ είναι ορθό;;α. Οι άμεσοι φόροι επιβάλλονται επί της τιμής των αγαθών;β. Ο Ειδικός φόρος κατανάλωσης εντάσσεται στην κατηγορία των έμμεσων φόρων;γ. Ο Φόρος Προστιθέμενης Αξίας εντάσσεται στους απρόσωπους φόρους;δ. Ο Φόρος Περιουσίας αξίας είναι άμεσος φόρος;
58. Σύμφωνα με την αρχή της «οριζόντιας φορολογικής ισότητας»:;α. Τα πιο εύπορα άτομα πρέπει να φορολογούνται περισσότερο από τα λιγότερο εύπορα άτομα;β. Άτομα που έχουν ίδια φοροδοτική ικανότητα πρέπει να φορολογούνται το ίδιο;γ. Άτομα που έχουν ίδιο εκπαιδευτικό επίπεδο πρέπει να φορολογούνται το ίδιο;δ. Όλες οι λοιπές προτάσεις είναι σωστές;
59. Ο Φόρος Προστιθέμενης Αξίας είναι:;α. Προσωπικός φόρος;β. Έμμεσος φόρος;γ. Φόρος κατά μονάδα προϊόντος;δ. Όλες οι λοιπές προτάσεις είναι σωστές;
60. Ποιος από τους παρακάτω φόρους ΔΕΝ είναι έμμεσος φόρος;;α. Ένας ειδικός φόρος στα τσιγάρα;β. Ένας φόρος επί των πωλήσεων αυτοκινήτων;γ. Ένας φόρος στην εστίαση;δ. Ο φόρος κληρονομιάς;
"61. Όταν ένας φόρος είναι αντίστροφα προοδευτικός με θετικό οριακό φορολογικό συντελεστή; τότε όταν αυξάνεται το εισόδημα:";"α. Ο συνολικός φόρος μειώνεται; ο μέσος φορολογικός συντελεστής μειώνεται; ο οριακός φορολογικός συντελεστής μειώνεται";"β. Ο συνολικός φόρος αυξάνεται; ο μέσος φορολογικός συντελεστής μειώνεται; ο οριακός φορολογικός συντελεστής αυξάνεται";"γ. Ο συνολικός φόρος μειώνεται; ο μέσος φορολογικός συντελεστής μειώνεται; ο οριακός φορολογικός συντελεστής αυξάνεται";"δ. Ο συνολικός φόρος αυξάνεται; ο μέσος φορολογικός συντελεστής μειώνεται; ο οριακός φορολογικός συντελεστής μειώνεται Πέμπτη 3 Ιουλίου 2025 έως και Δευτέρα 14 Ιουλίου 2025 Σελίδα 45 από 69";
62. Τι από τα παρακάτω θεωρείται φοροαποφυγή:;α. Η μη έκδοση φορολογικής απόδειξης.;β. Η αδήλωτη εργασία.;γ. Η μεταφορά της φορολογικής έδρας στο Λουξεμβούργο;δ. Όλες οι λοιπές προτάσεις είναι σωστές;
63. Όταν ο προϋπολογισμός εμφανίζει έλλειμμα και το κράτος πληρώνει τόκους για δάνεια που έχει λάβει τότε:;α. Το πρωτογενές έλλειμμα είναι μεγαλύτερο του ελλείματος του προϋπολογισμού;β. Το πρωτογενές έλλειμμα είναι ίσο του ελλείματος του προϋπολογισμού;γ. Το πρωτογενές έλλειμμα είναι μικρότερο του ελλείματος του προϋπολογισμού;δ. Υπάρχουν και άλλοι παράγοντες που επηρεάζουν το πρωτογενές έλλειμμα οπότε δεν μπορούμε να απαντήσουμε;
64. Ποιο από τα παρακάτω ΔΕΝ αποτελεί μέσο δράσης του κράτους;;α. Η αύξηση του βασικού επιτοκίου της μη ανεξάρτητης Κεντρικής Τράπεζας;β. Η αύξηση της τιμής του αργού πετρελαίου;γ. Επιβολή ανώτατων τιμών στα προϊόντα που πουλάνε οι καντίνες των πλοίων;δ. Ο φόρος κατανάλωσης στα προϊόντα καπνού;
"65. Ποιος επωμίζεται το κόστος των ασφαλιστικών παροχών;";α. Οι εργαζόμενοι/ες; οι εργοδότες/τριες και το κοινωνικό σύνολο";β. Οι εργοδότες/τριες και το κοινωνικό σύνολο;γ. Οι εργαζόμενοι/ες;δ. Οι εργαζόμενοι/ες και οι εργοδότες/τριες;
66. Το αγαθό “υγειονομική ασφάλιση και περίθαλψη” παρέχεται κυρίως από τον δημόσιο τομέα:;α. Επειδή είναι αξιόλογο αγαθό;β. Επειδή είναι υπηρεσία χαμηλής τιμής κατανάλωσης;"γ. Επειδή; λόγω του υψηλού κόστους παροχής της; καμία ιδιωτική ασφαλιστική εταιρεία δεν μπορεί να το παρέχει";δ. Καμία από τις λοιπές προτάσεις δεν είναι σωστή;
"67. Η απόλυτη μη ανταγωνιστικότητα στην κατανάλωση ενός αγαθού, από τη χρήση του οποίου δεν είναι δυνατόν να αποκλεισθεί κανείς; καθιστά το αγαθό αυτό:";α. Ιδιωτικό;β. Μη-αμιγώς δημόσιο;γ. Μη-αμιγώς δημόσιο εφόσον υπάρχει δημόσια παροχή του;δ. Αμιγώς δημόσιο;
68. Ποια από τις παρακάτω είναι η βασική λειτουργία των φόρων σε μια οικονομία; α. Να αυξήσουν την ανισότητα στα εισοδήματα β. Να χρηματοδοτήσουν δημόσια αγαθά και υπηρεσίες γ. Να μειώσουν την κατανάλωση αγαθών και υπηρεσιών δ. Να αυξήσουν τις αποταμιεύσεις των πολιτών;