Ερώτηση;Α;Β;Γ;Δ;Σωστή
37. Ποια από τις παρακάτω προτάσεις σχετικά με το Συμβούλιο Επιλογής Προϊσταμένων (Σ.Ε.Π.) του Υπουργείου Εσωτερικών είναι ΛΑΘΟΣ; Διενεργεί την δομημένη συνέντευξη για την επιλογή Προϊσταμένων Γενικής Διεύθυνσης; Είναι αρμόδιο για την επιλογή Προϊσταμένων Διεύθυνσης στους φορείς του δημοσίου τομέα;" Έχει πενταμελή σύνθεση, στην οποία μετέχουν δύο (2) μέλη του Ανώτατου Συμβουλίου Επιλογής Προσωπικού (Α.Σ.Ε.Π.)"; Έχει τριετή θητεία;Α
38. Ο/Η δημόσιος/α υπάλληλος εξυπηρετεί τους πολίτες κατά το ωράριο που έχει επιλέξει και έχει ενημερώσει την υπηρεσία του, αφιερώνοντας εξολοκλήρου και αποκλειστικά τον χρόνο εργασίας του/της στα καθήκοντά του/της. Παραμένει και πέρα του ισχύοντος χρόνου εργασίας:"; Εάν του/της ζητήσει συνάδελφός/ισσα του/της να τον/την βοηθήσει να ολοκληρώσουν κάποιες εκκρεμότητες; Προκειμένου να διευκολύνει τον/την Προϊστάμενο/η ο/η οποίος/α του/της ζήτησε να παραμείνει για να ολοκληρώσουν κάποιες εκκρεμότητες; Εφόσον έκτακτες και εξαιρετικές υπηρεσιακές ανάγκες το επιβάλλουν; Προκειμένου να ολοκληρώσει κάποιες εκκρεμότητες και επιθυμεί να πληρωθεί υπερωρίες;Γ
39. Καθ’ ύλην αρμόδιος φορέας για την παρακολούθηση και την προώθηση της εφαρμογής της αρχής της ίσης μεταχείρισης και των ίσων ευκαιριών είναι:; Ο/Η Σύμβουλος Ακεραιότητας της Δημόσιας Διοίκησης; Ο/Η Συνήγορος του Πολίτη; Η Γενική Γραμματεία Ισότητας και Ανθρωπίνων Δικαιωμάτων; Η Εθνική Αρχή Διαφάνειας;Β
40. Το Εθνικό Σύστημα Πολυεπίπεδης Διακυβέρνησης εφαρμόζεται:; Στον στενό δημόσιο τομέα; Σε όλα τα νομικά πρόσωπα δημοσίου δικαίου; Σε όλα τα νομικά πρόσωπα δημοσίου και ιδιωτικού δικαίου του δημόσιου τομέα; Στον δημόσιο τομέα και σε όλα τα νομικά πρόσωπα ιδιωτικού δικαίου του δημόσιου τομέα;Δ
41. Η διαβούλευση επί των νομοσχεδίων γίνεται και μέσω του δικτυακού τόπου www.opengov.gr και κατά κανόνα, διαρκεί:; Ένα (1) μήνα;  Δύο (2) μήνες;  Μία (1) εβδομάδα;  Δύο (2) εβδομάδες;Β
